{"byte_length":3007,"create_result":"CREATED_EXACT","event_id":"fixture-g0-policy-ratification","event_ref":"contracts/fixtures/governance-models/valid/g0-policy-ratification.json","event_revision":1,"event_sha256":"d2500565522714fc5de1ee77fa4b75d1a76f1c7382e0c5f4a412e02553b70508","fsync_result":"FILE_AND_PARENT_DIRECTORY_DURABLE","operation":"CREATE_IF_ABSENT","published_at":"2026-06-01T12:02:03Z","publisher_authority_ref":"contracts/fixtures/governance-models/valid/g0-operation-authority-event-publisher.json","publisher_authority_sha256":"f4ffdec35668f51c64f96d1fd4787ac91df6816fd7afae2ec9e433089bd858fb","publisher_id":"fixture-g0-event-publisher","receipt_id":"fixture-g0-policy-ratification-publication-receipt","receipt_issuer_id":"fixture-g0-terminal-receipt-issuer","repository_locator":"fixture://canonical-governance-subject/repository/r1","repository_permission_ref":"contracts/fixtures/governance-models/valid/g0-operation-authority-event-repository-permission.json","repository_permission_sha256":"39d1db5d05f8421d5f7be1560ac5d30248e13f81855d1ccf03a173c45ba76abd","schema":"ylx.g0-policy-ratification-publication-receipt.v1","signature":"MG/RPZxYSQGN6IyVYfMNVjtcjUilHmdIl4ZNNxwtF6cPjkmYCaFYb64xlRn2rotvy+H/TV0b3Hd7egXsYrNJCQ==","signature_algorithm":"Ed25519","signed_payload_sha256":"e33594b1ac8a8b33104f97f5c4e3c2902462f34ba86f08b294d485c9ad8e2840","signing_key_id":"fixture-g0-terminal-receipt-issuer-key","subject_sha256":"512084c150bffb12bd4abe7e6aca1bfdb30ee579ab0fe5210ec8f0739a1bfe1e","target_scope":"contracts/fixtures/governance-models/valid/g0-policy-ratification.json","terminal_sink_id":"fixture-g0-terminal-audit-sink"}